{
  "manifest_version": "1.2",
  "batch_id": "CL-MIG-001",
  "batch_class": "GOVERNANCE_AND_REGISTRIES",
  "mode": "PLAN",
  "created_at": "2026-07-13T20:41:11Z",
  "canonical_repo_root": "C:\\Users\\steve\\Projects\\gradient-institution",
  "canonical_cl_namespace": "C:\\Users\\steve\\Projects\\gradient-institution\\CRISIS_LITURGIES",
  "archive_drive_root": "C:\\Users\\steve\\My Drive\\The Gradient",
  "copy_authorized": false,
  "deletion_authorized": false,
  "rename_source_authorized": false,
  "builder_authorized": false,
  "commit_authorized": false,
  "human_authorization_record": null,
  "portable_authority_bundle": {
    "extract_root": "C:\\Users\\steve\\Projects\\gradient-institution\\CRISIS_LITURGIES\\00_PROJECT_CONTROL\\CL_PHASE_02_PLANNING\\CL_PHASE_01_PORTABLE_AUTHORITY_SOURCES_2026-07-13",
    "bundle_manifest": "C:\\Users\\steve\\Projects\\gradient-institution\\CRISIS_LITURGIES\\00_PROJECT_CONTROL\\CL_PHASE_02_PLANNING\\CL_PHASE_01_PORTABLE_AUTHORITY_SOURCES_2026-07-13\\00_MANIFEST\\BUNDLE_MANIFEST.json",
    "sha256sums_verified": true
  },
  "collection_state_map_ref": "C:\\Users\\steve\\Projects\\gradient-institution\\CRISIS_LITURGIES\\00_PROJECT_CONTROL\\CL_PHASE_02_PLANNING\\CL_PHASE_01_PORTABLE_AUTHORITY_SOURCES_2026-07-13\\03_STATE_ROOT_AND_DUPLICATES\\CL_COLLECTION_STATE_MAP_v1.0.json",
  "collection_state_map_sha256": "5e2752d60de8c8d468bf6603b6c545bf90641eed4091d0225c56237ea5c45e57",
  "preconditions": [
    "Portable authority source bundle extracted and SHA256SUMS verified",
    "ZIP-member pseudo-paths eliminated",
    "No .gdoc-only copy sources",
    "No duplicate target paths",
    "Human dry-run authorization review still required before mode COPY"
  ],
  "stop_conditions": [
    "target file exists",
    "source hash missing for COPY_FILE",
    "path-reference STOP unresolved",
    "Chachipti classification attempted inside CL-MIG-001",
    "frozen release would be altered"
  ],
  "items": [
    {
      "item_id": "MIG-0001",
      "collection_id": "CONTROL",
      "item_kind": "COPY_FILE",
      "source_path": "C:\\Users\\steve\\My Drive\\The Gradient\\CRISIS_LITURGIES\\00_PROJECT_CONTROL_CL_OPS_001\\CL_CONV_001_CHACHIPTI_PACKET_AUDIT_2026-07-12.md",
      "target_path": "C:\\Users\\steve\\Projects\\gradient-institution\\CRISIS_LITURGIES\\00_INSTITUTIONAL_CONTROL\\authority\\CL_CONV_001_CHACHIPTI_PACKET_AUDIT_2026-07-12.md",
      "source_exists": true,
      "byte_count": 9042,
      "sha256": "cb3a680d903fe6bc0be6a23f640e2b67a3a2f0c700c847894f2db83cc91f4054",
      "authority_source_path": null,
      "authority_source_sha256": null,
      "output_schema": null,
      "artifact_role": "AUTHORITY_RECORD",
      "relationship_class": "CANONICAL_ACTIVE_SOURCE",
      "batch_class": "GOVERNANCE_AND_REGISTRIES",
      "destination_occupancy": "PARENT_ABSENT",
      "copy_method": "COPY_FILE",
      "verification_method": "SHA256_MATCH",
      "rollback_method": "DELETE_TARGET",
      "status": "PLANNED",
      "block_reason": null,
      "notes": "CL-MIG-001 file-level copy plan"
    },
    {
      "item_id": "MIG-0002",
      "collection_id": "CONTROL",
      "item_kind": "COPY_FILE",
      "source_path": "C:\\Users\\steve\\My Drive\\The Gradient\\CRISIS_LITURGIES\\00_PROJECT_CONTROL_CL_OPS_001\\CL_PHASE_00_CURSOR_READONLY_INVENTORY_PACKET_2026-07-13.md",
      "target_path": "C:\\Users\\steve\\Projects\\gradient-institution\\CRISIS_LITURGIES\\00_PROJECT_CONTROL\\CL_PHASE_00_EVIDENCE\\CL_PHASE_00_CURSOR_READONLY_INVENTORY_PACKET_2026-07-13.md",
      "source_exists": true,
      "byte_count": 4990,
      "sha256": "98ebaec3f432ebf4d3cf34daf0e1fd8b40ac3bc6c0a29a9a3d8f377a9962dffe",
      "authority_source_path": null,
      "authority_source_sha256": null,
      "output_schema": null,
      "artifact_role": "EVIDENCE_REFERENCE",
      "relationship_class": "REGISTERED_MIRROR",
      "batch_class": "GOVERNANCE_AND_REGISTRIES",
      "destination_occupancy": "PARENT_ABSENT",
      "copy_method": "COPY_FILE",
      "verification_method": "SHA256_MATCH",
      "rollback_method": "DELETE_TARGET",
      "status": "PLANNED",
      "block_reason": null,
      "notes": "CL-MIG-001 file-level copy plan"
    },
    {
      "item_id": "MIG-0003",
      "collection_id": "CONTROL",
      "item_kind": "COPY_FILE",
      "source_path": "C:\\Users\\steve\\My Drive\\The Gradient\\CRISIS_LITURGIES\\00_PROJECT_CONTROL_CL_OPS_001\\CL_PHASE_00_EVIDENCE_FREEZE_COMPLETION_REPORT_2026-07-13.md",
      "target_path": "C:\\Users\\steve\\Projects\\gradient-institution\\CRISIS_LITURGIES\\00_PROJECT_CONTROL\\CL_PHASE_00_EVIDENCE\\CL_PHASE_00_EVIDENCE_FREEZE_COMPLETION_REPORT_2026-07-13.md",
      "source_exists": true,
      "byte_count": 2060,
      "sha256": "66eef2386e14a8602738e7f9cc5f3cfd3c83cf50ba218ff043de7ea684e6967c",
      "authority_source_path": null,
      "authority_source_sha256": null,
      "output_schema": null,
      "artifact_role": "EVIDENCE_REFERENCE",
      "relationship_class": "REGISTERED_MIRROR",
      "batch_class": "GOVERNANCE_AND_REGISTRIES",
      "destination_occupancy": "PARENT_ABSENT",
      "copy_method": "COPY_FILE",
      "verification_method": "SHA256_MATCH",
      "rollback_method": "DELETE_TARGET",
      "status": "PLANNED",
      "block_reason": null,
      "notes": "CL-MIG-001 file-level copy plan"
    },
    {
      "item_id": "MIG-0004",
      "collection_id": "CONTROL",
      "item_kind": "COPY_FILE",
      "source_path": "C:\\Users\\steve\\My Drive\\The Gradient\\CRISIS_LITURGIES\\00_PROJECT_CONTROL_CL_OPS_001\\CL_PHASE_00_MASTER_CONFLICT_LEDGER_2026-07-13.json",
      "target_path": "C:\\Users\\steve\\Projects\\gradient-institution\\CRISIS_LITURGIES\\00_PROJECT_CONTROL\\CL_PHASE_00_EVIDENCE\\CL_PHASE_00_MASTER_CONFLICT_LEDGER_2026-07-13.json",
      "source_exists": true,
      "byte_count": 10531,
      "sha256": "6017f61299c9aa11319ef25fa505098dec4e0729800917f04e73da9c29115609",
      "authority_source_path": null,
      "authority_source_sha256": null,
      "output_schema": null,
      "artifact_role": "EVIDENCE_REFERENCE",
      "relationship_class": "REGISTERED_MIRROR",
      "batch_class": "GOVERNANCE_AND_REGISTRIES",
      "destination_occupancy": "PARENT_ABSENT",
      "copy_method": "COPY_FILE",
      "verification_method": "SHA256_MATCH",
      "rollback_method": "DELETE_TARGET",
      "status": "PLANNED",
      "block_reason": null,
      "notes": "CL-MIG-001 file-level copy plan"
    },
    {
      "item_id": "MIG-0005",
      "collection_id": "CONTROL",
      "item_kind": "COPY_FILE",
      "source_path": "C:\\Users\\steve\\My Drive\\The Gradient\\CRISIS_LITURGIES\\00_PROJECT_CONTROL_CL_OPS_001\\CL_PHASE_00_MASTER_CONFLICT_LEDGER_2026-07-13.md",
      "target_path": "C:\\Users\\steve\\Projects\\gradient-institution\\CRISIS_LITURGIES\\00_PROJECT_CONTROL\\CL_PHASE_00_EVIDENCE\\CL_PHASE_00_MASTER_CONFLICT_LEDGER_2026-07-13.md",
      "source_exists": true,
      "byte_count": 4336,
      "sha256": "af019314861256545b691307d9593f62f260e92c62c05c7b39c07cec18506228",
      "authority_source_path": null,
      "authority_source_sha256": null,
      "output_schema": null,
      "artifact_role": "EVIDENCE_REFERENCE",
      "relationship_class": "REGISTERED_MIRROR",
      "batch_class": "GOVERNANCE_AND_REGISTRIES",
      "destination_occupancy": "PARENT_ABSENT",
      "copy_method": "COPY_FILE",
      "verification_method": "SHA256_MATCH",
      "rollback_method": "DELETE_TARGET",
      "status": "PLANNED",
      "block_reason": null,
      "notes": "CL-MIG-001 file-level copy plan"
    },
    {
      "item_id": "MIG-0006",
      "collection_id": "CONTROL",
      "item_kind": "COPY_FILE",
      "source_path": "C:\\Users\\steve\\My Drive\\The Gradient\\CRISIS_LITURGIES\\00_PROJECT_CONTROL_CL_OPS_001\\CL_PHASE_00_MASTER_EVIDENCE_REGISTER_2026-07-13.json",
      "target_path": "C:\\Users\\steve\\Projects\\gradient-institution\\CRISIS_LITURGIES\\00_PROJECT_CONTROL\\CL_PHASE_00_EVIDENCE\\CL_PHASE_00_MASTER_EVIDENCE_REGISTER_2026-07-13.json",
      "source_exists": true,
      "byte_count": 24954,
      "sha256": "ef53e1a4342cec06abd78ca04de2ee911a42809c0054f38a1a6916bd7f983434",
      "authority_source_path": null,
      "authority_source_sha256": null,
      "output_schema": null,
      "artifact_role": "EVIDENCE_REFERENCE",
      "relationship_class": "REGISTERED_MIRROR",
      "batch_class": "GOVERNANCE_AND_REGISTRIES",
      "destination_occupancy": "PARENT_ABSENT",
      "copy_method": "COPY_FILE",
      "verification_method": "SHA256_MATCH",
      "rollback_method": "DELETE_TARGET",
      "status": "PLANNED",
      "block_reason": null,
      "notes": "CL-MIG-001 file-level copy plan"
    },
    {
      "item_id": "MIG-0007",
      "collection_id": "CONTROL",
      "item_kind": "COPY_FILE",
      "source_path": "C:\\Users\\steve\\My Drive\\The Gradient\\CRISIS_LITURGIES\\00_PROJECT_CONTROL_CL_OPS_001\\CL_PHASE_00_MASTER_EVIDENCE_REGISTER_2026-07-13.md",
      "target_path": "C:\\Users\\steve\\Projects\\gradient-institution\\CRISIS_LITURGIES\\00_PROJECT_CONTROL\\CL_PHASE_00_EVIDENCE\\CL_PHASE_00_MASTER_EVIDENCE_REGISTER_2026-07-13.md",
      "source_exists": true,
      "byte_count": 11517,
      "sha256": "e4caeaba165b32f76022b8194c68d3b3cc6c2d327376fe94db35044630a8ff29",
      "authority_source_path": null,
      "authority_source_sha256": null,
      "output_schema": null,
      "artifact_role": "EVIDENCE_REFERENCE",
      "relationship_class": "REGISTERED_MIRROR",
      "batch_class": "GOVERNANCE_AND_REGISTRIES",
      "destination_occupancy": "PARENT_ABSENT",
      "copy_method": "COPY_FILE",
      "verification_method": "SHA256_MATCH",
      "rollback_method": "DELETE_TARGET",
      "status": "PLANNED",
      "block_reason": null,
      "notes": "CL-MIG-001 file-level copy plan"
    },
    {
      "item_id": "MIG-0008",
      "collection_id": "CONTROL",
      "item_kind": "COPY_FILE",